awards,name,station,genre,pr,dinner_budget,lunch_budget,rating,holiday,url,reserve_status,reserve_method,transportation,opening_time,extra_holiday_info,payment_methods,geo_coordinates,telephone,address,num_review
,車海老専科 天麩羅 手一束,御成門駅 449m , 天ぷら,【車海老本来の美味しさをリーズナブルに！】天麩羅職人の熟練の技術をカウンター席で是非！！,"￥4,000～￥4,999","￥4,000～￥4,999",3.46,,https://tabelog.com/tokyo/A1314/A131401/13191954/,予約可,ご予約時に、お名前とご連絡先を伺っております。,新橋駅より徒歩8分内幸町駅より徒歩7分御成門駅より徒歩6分大門駅より徒歩10分新虎通りと日比谷通りの交差点近く赤レンガ通り沿い 御成門駅から449m,11:30 - 14:30,※ラスト入店21:00※土曜日曜は若干早めに締めることがあります,カード可 （VISA、Master、JCB、AMEX、Diners） 電子マネー可 （交通系電子マネー（Suicaなど）、iD、QUICPay） QRコード決済可 （PayPay）,"35.663907938723135,139.754224284218",03-6721-5945,東京都港区新橋5-5-5 1F,210
,天成,池袋駅 446m , 天丼、天ぷら、居酒屋,,～￥999,～￥999,3.46,日曜日、祝日,https://tabelog.com/tokyo/A1305/A130501/13020848/,予約可,,ＪＲ山手線ほか【池袋駅】東口　徒歩５分東京メトロ丸ノ内線【池袋駅】徒歩６分東京メトロ有楽町線【池袋駅】徒歩７分西武池袋線【池袋駅】徒歩11分 池袋駅から446m,,,カード不可 電子マネー不可 QRコード決済不可,"35.73252203866696,139.7146777849388",03-3985-7366,東京都豊島区東池袋1-39-1 三善ビル 1F,184
,山田屋,三ノ輪駅 668m , そば、天ぷら、うどん,,-,-,3.46,土曜日、日曜日、祝日,https://tabelog.com/tokyo/A1311/A131104/13067924/,予約不可,,都営バス「竜泉」バス停から徒歩１分。このバス停には東武浅草駅、日暮里駅からもアクセス可能。地下鉄は日比谷線三ノ輪駅より徒歩１０分（バスだと１停留所） 三ノ輪駅から668m,,,カード不可 電子マネー不可 QRコード決済不可,"35.72358853869716,139.7916690847946",03-3874-7215,東京都台東区千束3-33-9 ,163
,まことや,上野御徒町駅 65m , 天ぷら、居酒屋,,"￥2,000～￥2,999","￥2,000～￥2,999",3.46,月曜日,https://tabelog.com/tokyo/A1311/A131101/13185398/,予約可,,上野御徒町駅から65m,11:30 - 15:00,■ 営業時間変更、売り切れになる場合があります,カード可 電子マネー可 QRコード決済可,"35.70746413870172,139.7738460846442",080-6982-7328,東京都台東区上野3-28-5 ,157
,屋形船 品川 船清,北品川駅 457m , 屋形船・クルージング、天ぷら、日本料理,テレビ、ドラマ、雑誌等に度々登場する、あの屋形船です。「船清（ふなせい）」です。,"￥10,000～￥14,999","￥10,000～￥14,999",3.46,-,https://tabelog.com/tokyo/A1314/A131403/13027426/,完全予約制,夜のコースは税込12000円～。,JR、又は京浜急行「品川駅」下車　徒歩12～13分。りんかい線、東京モノレール「天王洲アイル駅」徒歩13～14分 北品川駅から457m,,,カード可 （VISA、Master、JCB、AMEX、Diners） 電子マネー不可 QRコード決済不可,"35.6238613387453,139.7439619838207",03-5479-2731,東京都品川区北品川1-16-8 ,157
,掌庵 蕎麦 石はら,仙川駅 96m , そば、天ぷら、居酒屋,仙川駅3分◆石臼挽きの手打ち蕎麦や季節の逸品を、厳選地酒と共に味わう。居酒屋利用も◎,"￥4,000～￥4,999","￥4,000～￥4,999",3.46,,https://tabelog.com/tokyo/A1326/A132601/13101814/,予約可,,京王線「仙川駅」より徒歩3分 仙川駅から96m,,,カード可 （VISA、Master、JCB、AMEX、Diners） 電子マネー不可 QRコード決済可 （PayPay）,"35.66216173867001,139.58392498431974",03-5313-9330,東京都調布市仙川町2-21-4 ,154
,芳とも庵,牛込神楽坂駅 285m , そば、天ぷら、鍋,,"￥2,000～￥2,999","￥2,000～￥2,999",3.46,月曜日、火曜日,https://tabelog.com/tokyo/A1309/A130905/13040499/,予約可,※お昼のご予約は12時開始までとさせて頂き、当日のご予約はお受けしておりませんのでご了承くださいませ,都営地下鉄大江戸線【牛込神楽坂駅】徒歩５分東京メトロ有楽町線・南北線【市ケ谷駅】徒歩８分東京メトロ東西線【神楽坂駅】徒歩９分 牛込神楽坂駅から285m,17:30 - 21:00L.O. 20:30,■ 営業時間※お昼のご予約は12時開始までとさせて頂き、当日のご予約はお受けしておりませんのでご了承くださいませ※蕎麦売り切れ次第終了となります◇最新情報はInstagramで更新中◇■ 定休日不定休,カード不可 電子マネー不可 QRコード決済不可,"35.69802363869505,139.73407188457674",03-3235-7177,東京都新宿区納戸町10 ,153
,天ぷら てん作,水天宮前駅 164m , 天ぷら、天丼,,～￥999,～￥999,3.46,土曜日、日曜日、祝日,https://tabelog.com/tokyo/A1302/A130204/13041005/,予約不可,,水天宮前駅から164m,,,カード不可 電子マネー不可 QRコード決済不可,"35.68418733872025,139.78560908440087",03-3668-8301,東京都中央区日本橋蛎殻町2-5-6 ,134
,讃岐のおうどん 花は咲く 新宿戸山店,若松河田駅 442m , うどん、居酒屋、天ぷら,,"￥1,000～￥1,999","￥1,000～￥1,999",3.46,,https://tabelog.com/tokyo/A1304/A130401/13222066/,予約可,,副都心線　東新宿駅から徒歩7分大江戸線　若松河田駅から徒歩5分都営バス　新宿ここ・から広場前から徒歩3分都営バス　国立国際医療研究センター病院前から徒歩3分 若松河田駅から442m,11:00 - 15:00L.O. 15:00,■ 営業時間※土日祝日は通し営業ですが、平日同様のランチメニューをご注文いただけます。■定休日なし,カード可 （VISA、Master、JCB、AMEX、Diners） 電子マネー可 （交通系電子マネー（Suicaなど）、iD、QUICPay） QRコード決済可 （PayPay、d払い、au PAY）,"35.70127113868653,139.71383788462373",03-6273-8798,東京都新宿区新宿7-3-36 戸山センチュリー 1F,134
,つな八 品川インターシティ店,品川駅 353m , 天ぷら、天丼、日本料理,,"￥5,000～￥5,999","￥5,000～￥5,999",3.46,-,https://tabelog.com/tokyo/A1314/A131403/13017766/,予約可,,ＪＲ、京急品川駅徒歩5分 品川駅から353m,11:00 - 15:00L.O. 14:30,■ 営業時間［月～金］最終入店21：00■ 定休日無休（品川インターシティ休館日は休業）,カード可 （VISA、Master、JCB、AMEX、Diners） 電子マネー可 （楽天Edy） QRコード決済不可,"35.62668061474148,139.74193968504667",03-3740-2784,東京都港区港南2-15-2 品川インターシティ S＆R棟 3F,133
,浅草割烹 天とよ 神保町店,神保町駅 150m , 居酒屋、天ぷら、海鮮,老舗天ぷら屋に生まれ育った店主が提案する、気軽に使える天ぷらと割烹のお店,"￥3,000～￥3,999","￥3,000～￥3,999",3.46,,https://tabelog.com/tokyo/A1310/A131003/13229844/,予約可,※ランチのご予約は《事前注文》のみ※30分以内等、直前のご予約は混雑状況により承れない場合もございます。必ずお電話にてご確認ください※基本２時間制とさせて頂きます。混雑日以外は２時間でなくても構いませんので、コメント欄にその旨ご入力をお願い致します。ご連絡ない場合は２時間までのお席となります。なお、金曜日等混雑日は２時間以上で承れない場合もございます。ご了承ください。,都営三田線 神保町駅（A5出口）徒歩2分 都営新宿線 神保町駅（A5出口）徒歩2分 神保町駅から150m,11:30 - 15:00L.O. 15:00,■ 営業時間ランチタイム11:30~15:00※ランチのご予約は事前注文のみディナータイム[月～金] 17:00～23:00（L.O フード 22:00、ドリンク 22:30）■ 定休日不定休、基本は土日祝休まず営業(※土日祝は21時までの営業),カード可 （VISA、Master、JCB、AMEX、Diners） 電子マネー不可 QRコード決済可 （PayPay、d払い、楽天ペイ、au PAY）,"35.69660453870396,139.75920528454478",03-6811-7464,東京都千代田区神田神保町1-18-1 千石屋ビル102,131
,天冨良 かんの,梅ケ丘駅 113m , 天ぷら、天丼,梅ヶ丘駅徒歩3分！職人による伝統の天ぷら、厳選された旬の魚・野菜が気軽に楽しめます。,"￥6,000～￥7,999","￥6,000～￥7,999",3.46,,https://tabelog.com/tokyo/A1318/A131812/13001465/,予約可,"ランチタイムのご予約は、5,500円のコース（華）からのみとさせていただいております。予めご了承ください。",小田急線梅ヶ丘駅南口から 徒歩3分 梅ケ丘駅から113m,11:30 - 14:00L.O. 13:15,■ 定休日臨時休業する場合ございます、ホームページもあわせて御覧ください,カード不可 電子マネー不可 QRコード決済不可,"35.6553372386968,139.65446648420138",03-3425-2460,東京都世田谷区梅丘1-19-6 ,128
,蕎肆 浅野屋,糀谷駅 358m , そば、うどん、天ぷら,,-,-,3.46,日曜日,https://tabelog.com/tokyo/A1315/A131503/13043636/,予約可,夜は予約可,京急空港線糀谷駅の改札口を出て右に進み、糀谷駅前交差点の信号を渡って右折する。環八通りに沿って進み、次の信号（角に『すき家』がある交差点）で環八通りから左奥に向かって外れる道に入り、約200m先にある。糀谷駅から約450m、徒歩約6分。 糀谷駅から358m,,,カード不可 電子マネー不可 QRコード決済不可,"35.55521353878304,139.72559988314015",03-3738-3426,東京都大田区南蒲田2-18-4 ,126
,ふたばや,京王八王子駅 571m , うどん、カレーうどん、天ぷら,,-,-,3.46,日曜日、祝日,https://tabelog.com/tokyo/A1329/A132904/13051442/,予約不可,,JR中央線八王子駅京王線京王八王子駅 京王八王子駅から571m,,,カード不可 電子マネー不可 QRコード決済不可,"35.65305523859962,139.34472208439544",0426-42-6030,東京都八王子市子安町1-44-5 ,119
,天ぷらめし 金子屋,吉祥寺駅 324m , 天ぷら,,"￥1,000～￥1,999","￥1,000～￥1,999",3.46,-,https://tabelog.com/tokyo/A1320/A132001/13216451/,予約不可,,吉祥寺駅から324m,,,カード不可 電子マネー不可,"35.705729855113425,139.57820381038988",0422-20-4008,東京都武蔵野市吉祥寺本町2-4-17 1F,115
,天ぷら 天芝,赤羽橋駅 302m , 天ぷら、日本酒バー、焼酎バー,,"￥8,000～￥9,999","￥8,000～￥9,999",3.46,,https://tabelog.com/tokyo/A1314/A131401/13016697/,予約可,当ホテルでは特定原材料7品目（えび・かに・小麦・そば・卵・乳・落花生）以外の食物アレルギーにつきましては、正確な情報を入手することが困難であるため、特定原材料7品目のみ対応をいたしております。あらかじめご了承ください。,○JR線・東京モノレール浜松町駅から徒歩12分。○都営地下鉄浅草線・大江戸線大門駅(A6)から徒歩9分。○地下鉄日比谷線神谷町駅(1番)から徒歩12分。○都営地下鉄大江戸線赤羽橋駅(赤羽橋口)から徒歩2分。○都営地下鉄三田線芝公園駅(A4）から徒歩3分、御成門駅(A1)から徒歩5分。○浜松町駅（大門駅）からホテルまで無料シャトルバスを運行しております。（定員41名さま） 赤羽橋駅から302m,,,カード可 （VISA、Master、JCB、AMEX、Diners） 電子マネー可 （交通系電子マネー（Suicaなど）、iD） QRコード決済可 （PayPay、d払い、楽天ペイ、au PAY）,"35.65559763872617,139.747169184139",03-5400-1111,東京都港区芝公園4-8-1 ザ・プリンス パークタワー東京 B1F,94
,天婦羅 若竹,高輪台駅 367m , 天ぷら、天丼、日本料理,,"￥8,000～￥9,999","￥8,000～￥9,999",3.46,-,https://tabelog.com/tokyo/A1316/A131603/13013968/,予約可,,新幹線／JR線／京浜急行線　品川駅　高輪口から徒歩5分都営地下鉄浅草線　高輪台駅　徒歩3分 高輪台駅から367m,11:30 - 15:00L.O. 14:30,■定休日無休,カード可 （VISA、Master、JCB、AMEX、Diners） 電子マネー可 （交通系電子マネー（Suicaなど）、楽天Edy、iD、QUICPay） QRコード決済可 （PayPay、楽天ペイ、au PAY）,"35.63167939374338,139.73445313220702",03-3447-1139,東京都港区高輪3-13-1 グランドプリンスホテル高輪 1F,75
,つるや,浅草（東武・都営・メトロ）駅 130m , うなぎ、天ぷら、どじょう,,"￥6,000～￥7,999","￥6,000～￥7,999",3.45,水曜日,https://tabelog.com/tokyo/A1311/A131102/13023284/,予約可,,銀座線浅草駅 徒歩10秒/浅草線浅草駅 徒歩1分 浅草駅（東武・都営・メトロ）から130m,,,カード可 （VISA、Master、JCB、AMEX、Diners） 電子マネー不可 QRコード決済不可,"35.71175193870653,139.79749678467093",03-3841-0280,東京都台東区浅草1-33-2 ,202
,天まる,二重橋前駅 190m , 天ぷら、日本料理、海鮮,【東京駅徒歩1分】職人が丁寧に仕上げる天麩羅,"￥4,000～￥4,999","￥4,000～￥4,999",3.45,,https://tabelog.com/tokyo/A1302/A130201/13000304/,予約可,ご予約日の２日前以降のキャンセルは、お料理代金の半額をお申し受けいたします。,ＪＲ東京駅丸の内口から 徒歩2分 二重橋前駅から190m,11:00 - 15:00L.O. 14:30,■ 定休日施設の休業に準ずる,カード可 （VISA、Master、JCB、AMEX、Diners） 電子マネー可 （交通系電子マネー（Suicaなど）） QRコード決済可 （PayPay、d払い、楽天ペイ、au PAY）,"35.68108563871519,139.76349888438503",03-3240-6033,東京都千代田区丸の内2-4-1 丸の内ビルディング 6F,198
,十割蕎麦 嵯峨谷 神田小川町店,小川町駅 61m , そば、天ぷら、うどん,,～￥999,～￥999,3.45,-,https://tabelog.com/tokyo/A1310/A131002/13204379/,予約不可,,都営新宿線　小川町駅　徒歩2分東京メトロ千代田線　新御茶ノ水駅　徒歩4分東京メトロ丸の内線　淡路町駅　徒歩3分 小川町駅から61m,07:00 - 22:00L.O. 21:45,■ 営業時間新型コロナウイルスの影響により営業時間の変更がある場合が御座います。■定休日無休,カード不可 電子マネー不可 QRコード決済不可,"35.695048438707026,139.76574698452447",03-6206-4180,東京都千代田区神田小川町1-8-3 小川町北ビル 1F,178
,平次のおうどん,東府中駅 345m , うどん、天ぷら、居酒屋,東府中駅4分◆“本場さぬき”の自家製麺と特製だしが自慢！名物の肉汁うどんや、天ぷらもぜひ◎,"￥2,000～￥2,999","￥2,000～￥2,999",3.45,,https://tabelog.com/tokyo/A1326/A132602/13116944/,予約可,,電車：京王線　「東府中」駅　下車　徒歩4分 東府中駅から345m,11:00 - 15:00L.O. 14:30,■ 定休日不定休,カード可 （VISA、Master、JCB、AMEX、Diners） 電子マネー不可 QRコード決済可 （PayPay）,"35.670232238635684,139.49223468446556",042-354-8555,東京都府中市緑町3-3-1 ヴェールメゾン府中,165
,吉祥寺 砂場,吉祥寺駅 108m , そば、天ぷら,,"￥4,000～￥4,999","￥4,000～￥4,999",3.45,火曜日,https://tabelog.com/tokyo/A1320/A132001/13009944/,予約可,,ＪＲ中央線・総武線、井の頭線「吉祥寺駅」より徒歩5分シュープラザビルB１F 吉祥寺駅から108m,11:00 - 15:00,■ 営業時間緊急事態宣言中につき営業時間を短縮しております。※定休日の変更ある場合もございますので詳しくは店舗にお問い合わせください,カード不可 電子マネー不可 QRコード決済不可,"35.70411673864209,139.57992508474635",0422-20-9808,東京都武蔵野市吉祥寺本町1-9-10 シュープラザビル B1F,158
,浅草橋百そば,浅草橋駅 225m , そば、天ぷら、カレー,,-,-,3.45,-,https://tabelog.com/tokyo/A1311/A131103/13229584/,予約不可,,浅草橋駅A6出口より徒歩1分（50m） 浅草橋駅から225m,11:00 - 21:00L.O. 20:30,■定休日なし,カード可 （VISA、Master、JCB、AMEX、Diners） 電子マネー可 （交通系電子マネー（Suicaなど）、楽天Edy、iD、QUICPay）,"35.69815933871201,139.7876091845406",03-5846-9138,東京都台東区柳橋1-32-5 ,135
,てんぷら 天翔,外苑前駅 78m , 天ぷら、日本料理、天丼,外苑前駅より徒歩1分。上質な旬の食材を楽しめるてんぷら料理の専門店。個室もございます。,"￥10,000～￥14,999","￥10,000～￥14,999",3.45,,https://tabelog.com/tokyo/A1306/A130603/13214300/,予約可,,東京メトロ銀座線　外苑前　4a出口　徒歩1分東京メトロ銀座線　青山一丁目駅　4番出口　徒歩7分東京メトロ半蔵門線　青山一丁目駅　4番出口　徒歩7分都営地下鉄道大江戸線　青山一丁目駅　4番出口　徒歩7分 外苑前駅から78m,11:30 - 15:00L.O. 14:00,■ コースラストオーダー＜ランチ＞13:30＜ディナー＞20:30■定休日無休,カード可 （VISA、Master、JCB、AMEX、Diners、UnionPay） 電子マネー不可 QRコード決済不可,"35.67105203870701,139.7178433843157",050-3184-3600,東京都港区北青山2-7-13 プラセオ青山ビル 1F,130
,かど新 西口店,新宿駅 297m , 海鮮、天ぷら、居酒屋,,"￥5,000～￥5,999","￥5,000～￥5,999",3.45,-,https://tabelog.com/tokyo/A1304/A130401/13047800/,予約可,,新宿駅南口を起点として、甲州街道西新宿へFirst Kitchenの交差点から新宿駅西口へ向かって二本目を左折し、京王プラザ方面へ向かう新宿郵便局通りの一つ手前の筋角の2・4階に「かど新」あり． 新宿駅から297m,,,カード可 （VISA、Master、JCB、AMEX） 電子マネー不可 QRコード決済不可,"35.68944723868874,139.697163684516",03-3343-3331,東京都新宿区西新宿1-12-6 ,129
,肥後一文字や,神保町駅 362m , 立ち食いそば、天ぷら、うどん,,-,-,3.45,日曜日,https://tabelog.com/tokyo/A1310/A131003/13126581/,予約不可,,都営地下鉄三田線・新宿線東京メトロ半蔵門線【神保町駅】徒歩６分ＪＲ中央線【水道橋駅】東口　徒歩７分ＪＲ中央線・総武線【御茶ノ水駅】御茶ノ水橋口　徒歩９分 神保町駅から362m,,,カード不可 電子マネー不可 QRコード決済不可,"35.69877263870238,139.7586030845671",03-3296-0328,東京都千代田区神田猿楽町2-2-6 ,126
,てんぷら天芳,秋葉原駅 189m , 天ぷら、天丼,,"￥5,000～￥5,999","￥5,000～￥5,999",3.45,-,https://tabelog.com/tokyo/A1310/A131001/13125375/,予約可,,ＪＲ山手線・京浜東北線　秋葉原駅　中央口出口　徒歩２分つくばエクスプレス秋葉原駅　A3出口　徒歩３分 秋葉原駅から189m,,,カード不可 電子マネー不可 QRコード決済不可,"35.7000231224955,139.77390411873995",03-3251-1037,東京都千代田区神田練塀町3 富士ソフトビル１Ｆ,125
,うどん屋 大作,京急蒲田駅 505m , うどん、天ぷら,,"￥1,000～￥1,999","￥1,000～￥1,999",3.45,水曜日,https://tabelog.com/tokyo/A1315/A131503/13212106/,予約可,電話は出られないことが多いです。SNSからの問い合わせ下さい。,京急蒲田駅から505m,11:30 - 14:30,【定休日】毎週水曜日　と　第二木曜日,カード可 電子マネー可 QRコード決済可,"35.565135038775594,139.7219759832429",03-6428-6734,東京都大田区蒲田1-18-7 ,113
,築地 和み,築地駅 188m , 日本料理、海鮮、天ぷら,,"￥6,000～￥7,999","￥6,000～￥7,999",3.45,,https://tabelog.com/tokyo/A1313/A131301/13267787/,予約可,,日比谷線、築地駅より徒歩５分都営浅草線、東銀座駅より徒歩７分 築地駅から188m,11:15 - 14:30L.O. 料理14:00,"12/31,1/1はお休みです。",カード可 （VISA、Master、JCB、AMEX、Diners、UnionPay） 電子マネー可 （iD） QRコード決済可 （PayPay）,"35.66739363872619,139.77074738424164",03-3546-1489,東京都中央区築地2-14-12 ,99
,一の井,羽田空港第１ターミナル（東京モノレール）駅 270m , そば、天ぷら,,"￥1,000～￥1,999","￥1,000～￥1,999",3.44,-,https://tabelog.com/tokyo/A1315/A131504/13243010/,,,羽田空港第１ターミナル駅（東京モノレール）から270m,06:00 - 22:00L.O. 21:30,■ 営業時間7/18現在、COVID-19自粛の関係で営業時間変更中,カード可,"35.55075253880412,139.78282888305498",03-5757-9505,東京都大田区羽田空港3-3-2 東京国際空港 第1旅客ターミナルビル 北ウイング 3F,299
,天ぷら 天喜代 東京駅店,東京駅 110m , 天ぷら、天丼、海鮮,,"￥3,000～￥3,999","￥3,000～￥3,999",3.44,-,https://tabelog.com/tokyo/A1302/A130201/13160654/,予約可,,ＪＲ 東京駅 徒歩3分 地下鉄丸ノ内線 東京駅 徒歩5分 東京駅から110m,11:00 - 23:00,■ 営業時間ランチ11：00～15：00ディナー15：00～23：00（L.O.22：00）■定休日無休,カード可 （VISA、Master、JCB、Diners） 電子マネー可 （交通系電子マネー（Suicaなど）） QRコード決済不可,"35.680561424505456,139.76837639759884",03-6269-9926,東京都千代田区丸の内1-9-1 グランルーフ B1F,263
,中目黒いぐち 上ル,恵比寿駅 185m , 串揚げ、天ぷら、日本料理,天ぷら割烹【11/26(火)本日お席案内できます‼️】 新米入荷致しました！ご堪能ください！,"￥8,000～￥9,999","￥8,000～￥9,999",3.44,,https://tabelog.com/tokyo/A1303/A130302/13184983/,予約可,申し訳ございませんが、心無い 当日キャンセルは、100％　の　キャンセル料を頂いております。　また、連絡無しの場合は、電話番号を審査協会に登録させて頂き、グループ店舗でのご予約が出来なくなります。,恵比寿駅から徒歩1分　恵比寿1丁目交差点　1Ｆ銀座メガネの楠ビルを5階まで　右側の階段で上がり下さいませ　m(__)m　看板もポストに表記もございません。 恵比寿駅から185m,17:00 - 23:00,コース料理提供時間の兼ね合いで最終入店21：00とさせていただきます。■定休日年末年始,カード可 （VISA、Master、JCB、AMEX） 電子マネー不可 QRコード決済不可,"35.64850713871886,139.71009988409338",03-5422-9153,東京都渋谷区東3-25-6 楠ビル5F,260
,魚三四味家 自由ヶ丘店,自由が丘駅 81m , 居酒屋、海鮮、天ぷら,【駅１分❗️】旬の魚料理と旨い酒が自慢！国産生牡蠣352円〜⁉️,"￥2,000～￥2,999","￥2,000～￥2,999",3.44,,https://tabelog.com/tokyo/A1317/A131703/13157814/,予約可,※当日、ご予約の人数より来店人数が少なかった場合でも、ご予約人数で金額を頂戴致します。人数変更は前日までにご連絡をお願い致します。※25名様以上のご予約はお電話にてお願いいたします。最大50名様までご予約可能です！【席のみ予約の注意事項】※定食でのご予約はご遠慮頂いております。もしご予約をされた場合は、ご来店時にご予約をキャンセルさせて頂きますので、予めご了承下さい。,東急東横線・東急大井町線 自由が丘駅 北・南口 徒歩1分 自由が丘駅から81m,11:30 - 14:00,■ 営業時間混雑状況により閉店時間が早まる場合があります。■定休日年中無休,カード可 電子マネー不可 QRコード決済可 （PayPay）,"35.60683963873193,139.66804888370197",03-3723-5570,東京都目黒区自由が丘2-13-2 スカイプラザビル B1F,219
,手打ち蕎麦 たむら,東日本橋駅 110m , そば、天ぷら、居酒屋,打ちたての手打ちそばと樽酒が楽しめる,"￥3,000～￥3,999","￥3,000～￥3,999",3.44,,https://tabelog.com/tokyo/A1302/A130204/13206706/,予約可,,都営浅草線「東日本橋」駅　B4出口より徒歩2分都営新宿線「馬喰横山」駅　徒歩3分JR総武線「馬喰町」駅　出口3より徒歩4分 東日本橋駅から110m,10:30 - 22:30,■ 定休日無休(たまに休みです),カード可 （VISA、Master、JCB、AMEX、Diners） 電子マネー可 （交通系電子マネー（Suicaなど）、楽天Edy、nanaco、WAON、iD、QUICPay） QRコード決済可 （PayPay、d払い、楽天ペイ、au PAY）,"35.69257791145878,139.78396232770572",03-6231-0085,東京都中央区東日本橋3-10-9 ,213
,八重洲 天ぷら串 山本家,日本橋駅 280m , 天ぷら、居酒屋、日本酒バー,天ぷら串と自然薯の専門店、ナチュラルワインや日本酒、クラフト焼酎揃えております。,"￥4,000～￥4,999","￥4,000～￥4,999",3.44,,https://tabelog.com/tokyo/A1302/A130202/13238331/,予約可,【席のみ予約の注意事項】※混雑時はお席の時間を2時間制とさせていただいております。,東京駅より徒歩５分日本橋駅より徒歩３分つけ麺つじ田さんの裏にお店があります。 日本橋駅から280m,11:30 - 14:30L.O. 14:00,年末年始はお休みです。・2024/12/31~2025/1/5まで,カード可 （VISA、Master、JCB、AMEX、Diners） 電子マネー不可 QRコード決済可 （PayPay）,"35.682487038716836,139.7714878843936",03-6910-3588,東京都中央区八重洲1-4-9 1F,209
