awards,name,station,genre,pr,dinner_budget,lunch_budget,rating,holiday,url,reserve_status,reserve_method,transportation,opening_time,extra_holiday_info,payment_methods,geo_coordinates,telephone,address,num_review
,天串にしおか,勝どき駅 351m , 天ぷら、居酒屋、串揚げ,,"￥2,000～￥2,999","￥2,000～￥2,999",3.12,,https://tabelog.com/tokyo/A1313/A131302/13138269/,予約可,,都営大江戸線　勝どき駅　A4b出口徒歩3分 勝どき駅から351m,,,カード可 電子マネー可 QRコード決済可,"35.65743773873372,139.77457818413865",03-3532-1610,東京都中央区勝どき3-8-8 104,43
,天松,八丁堀駅 295m , 天ぷら,,-,-,3.12,土曜日、日曜日、祝日,https://tabelog.com/tokyo/A1302/A130203/13082660/,予約可,,八丁堀駅から295m,,,カード可 （JCB、AMEX、Diners） 電子マネー不可 QRコード決済可,"35.67467843872482,139.78099258430802",03-3551-8703,東京都中央区新川2-19-11 ,36
,釣新,蔵前駅 482m , 屋形船・クルージング、海鮮、天ぷら,,"￥10,000～￥14,999","￥10,000～￥14,999",3.12,-,https://tabelog.com/tokyo/A1312/A131201/13033314/,予約不可,,都営大江戸線蔵前駅A7出口を出て、厩橋を渡ってスグのところに店舗がございます。 蔵前駅から482m,,,カード可 （VISA、Master、JCB、AMEX、Diners） 電子マネー不可,"35.70387943871107,139.79604818459245",03-3622-3572,東京都墨田区本所1-3-11 ,34
,河内家,大森駅 317m , 天ぷら,,-,-,3.12,土曜日、日曜日、祝日,https://tabelog.com/tokyo/A1315/A131502/13081450/,予約可,,JR大森駅東口から徒歩4分 大森駅から317m,,,カード不可 電子マネー不可,"35.58636773876436,139.72901988345248",03-3761-6878,東京都大田区大森北1-13-2 ,33
,中村屋,馬込駅 151m , そば、うどん、天ぷら,,～￥999,～￥999,3.12,日曜日,https://tabelog.com/tokyo/A1317/A131713/13068496/,予約可,予約は電話のみ受付しております,"馬込駅A1,A3出口から徒歩3分 馬込駅から151m",,,カード可 電子マネー不可,"35.59662943875185,139.7102132835693",03-3771-2734,東京都大田区北馬込2-27-13 ,33
,錦天,南阿佐ケ谷駅 265m , 天ぷら、天丼,,-,-,3.12,-,https://tabelog.com/tokyo/A1319/A131905/13013611/,予約可,,東京メトロ丸ノ内線【南阿佐ケ谷駅】徒歩４分ＪＲ中央線【阿佐ケ谷駅】徒歩５分 南阿佐ケ谷駅から265m,,,カード可 （VISA、Master、JCB、AMEX、Diners） 電子マネー不可 QRコード決済不可,"35.701828138661284,139.63565188468414",03-3398-8363,東京都杉並区阿佐谷南3-2-22 第二山幸 1F,32
,田ごと 光悦舗 京王百貨店新宿店,新宿駅 119m , 日本料理、天ぷら、寿司,,"￥3,000～￥3,999","￥3,000～￥3,999",3.12,-,https://tabelog.com/tokyo/A1304/A130401/13041831/,予約可,昼夜ご予約可です。お電話にてお問い合わせくださいませ。,JR新宿駅西口より、改札出て5分。 新宿駅から119m,11:00 - 16:30L.O. 15:00,■ 平日15:00～17:00甘味のみご提供しております■ 定休日京王百貨店休業日に準ずる,カード可 （VISA、Master、JCB、AMEX、Diners） 電子マネー不可 QRコード決済可,"35.690071438688925,139.698995484521",03-5321-5971,東京都新宿区西新宿1-1-4 京王百貨店新宿店 8F,31
,天ぷら さき亭 国際線旅客ターミナルビル羽田空港店,羽田空港第３ターミナル（京急）駅 263m , 天ぷら,,"￥1,000～￥1,999","￥1,000～￥1,999",3.12,-,https://tabelog.com/tokyo/A1315/A131504/13234727/,予約不可,,羽田空港第３ターミナル駅（京急）から263m,,,カード可 電子マネー可 QRコード決済可,"35.54722333880172,139.7682974830295",03-6428-0295,東京都大田区羽田空港2-6-5 東京国際空港国際線旅客ターミナルビル 3F TOKYO SKY KITCHEN内,27
,天ぷら 甚兵衛,目黒駅 119m , 天ぷら,,-,-,3.12,-,https://tabelog.com/tokyo/A1316/A131601/13055790/,予約可,夜の部はコース料理のみとなり、ご予約のみの営業とさせていただきます。尚、ご予約は前日の15時迄によろしくおねがいします。,ＪＲ山手線【目黒駅】東口　徒歩２分東急目黒線、都営地下鉄三田線、東京メトロ南北線【目黒駅】徒歩３分 目黒駅から119m,,,カード可 （VISA、Master、JCB、AMEX、Diners） 電子マネー不可,"35.634322638730055,139.7169608839453",不明の為情報お待ちしております,東京都品川区上大崎2-14-3 三笠ビル 1F,27
,柳ばし,雪が谷大塚駅 46m , うなぎ、天ぷら、あんこう,,"￥4,000～￥4,999","￥4,000～￥4,999",3.12,木曜日,https://tabelog.com/tokyo/A1317/A131714/13121724/,予約可,,東急池上線雪が谷大塚駅徒歩1分 雪が谷大塚駅から46m,11:30 - 14:30L.O. 13:30,■ 定休日第3水曜日,カード可 （VISA、Master、JCB、AMEX、Diners） 電子マネー不可,"35.5922239387452,139.6805525835456",03-3720-1544,東京都大田区雪谷大塚町7-13 ＥＥＬ ＨＯＵＳＥ 1991,26
,天麩羅 晴光,浅草（つくばＥＸＰ）駅 258m , 天ぷら、天丼,,-,-,3.12,-,https://tabelog.com/tokyo/A1311/A131102/13040485/,予約可,,ＴＸ線「浅草」駅・徒歩５分 浅草駅（つくばＥＸＰ）から258m,,,カード可 （JCB、AMEX） 電子マネー可,"35.71195523870523,139.79381448467558",03-3844-8701,東京都台東区浅草1-14-8 ,25
,一心亭,川井駅 797m , そば、かつ丼、天ぷら,,-,-,3.12,-,https://tabelog.com/tokyo/A1330/A133004/13117075/,予約可,,吉野街道沿い 川井駅から797m,,,カード不可,"35.8077975384423,139.15934588608843",0428-85-2231,東京都西多摩郡奥多摩町丹三郎41-1 ,24
,和天 吉,奥沢駅 141m , 天ぷら、バル、居酒屋,,"￥6,000～￥7,999","￥6,000～￥7,999",3.12,火曜日,https://tabelog.com/tokyo/A1317/A131711/13156783/,予約可,,☆予約優先☆目黒線・奥沢駅から約1分、自由が丘 駅から約8分、奥沢神社から約3分、自由通り沿い。自由が丘駅から615m 奥沢駅から141m,18:00 - 23:00L.O. 料理21:00 ドリンク22:30,■ 営業時間最終入店21:00☆昼営業のお知らせお昼（完全予約制、当日不可）は4名様から承ります（お承け出来ない場合がございます）。お料理はディナーコースと同じになります。詳細ご予約は、お電話にてお問い合わせ下さい。☆キャンセルポリシー☆ご予約の当日キャンセル、無断キャンセルはキャンセル料（コース代100%）がかかりますので、御注意下さい。■ 定休日毎週火曜日（連休あります）,カード可 電子マネー可 （交通系電子マネー（Suicaなど）、楽天Edy、nanaco、WAON、iD、QUICPay） QRコード決済可 （d払い、楽天ペイ、au PAY）,"35.60266753873585,139.67202538365703",03-6425-8152,東京都世田谷区奥沢3-31-10 ,22
,天好,国立駅 507m , うなぎ、天ぷら,,"￥2,000～￥2,999","￥2,000～￥2,999",3.12,火曜日,https://tabelog.com/tokyo/A1325/A132503/13082650/,予約可,,JR中央線「国立駅」北口歩7、8分北口ロータリーを真っ直ぐ歩き、モスバーガーの信号を右折。坂を登り切り５０Mくらい行った左手。 国立駅から507m,11:30 - 14:00L.O. 13:30,■ 定休日不定休あり,カード不可 電子マネー不可 QRコード決済不可,"35.70205453860221,139.45059508481614",042-575-7861,東京都国分寺市富士本1-21-44 ,16
,カドナシヤ,赤羽駅 195m , 居酒屋、天ぷら、海鮮,,"￥3,000～￥3,999","￥3,000～￥3,999",3.12,-,https://tabelog.com/tokyo/A1323/A132305/13207429/,予約不可,,JR赤羽駅 北改札 西口から徒歩1分 赤羽駅から195m,17:00 - 01:00,■ 定休日不定休,カード不可 電子マネー不可 QRコード決済可 （PayPay）,"35.77898203863897,139.71943618540473",080-8846-0088,東京都北区赤羽西1-39-2 ,12
,千成寿司,国立駅 589m , 寿司、海鮮、天ぷら,,-,-,3.12,水曜日,https://tabelog.com/tokyo/A1325/A132503/13071748/,予約可,,ＪＲ中央線の国立駅南口から旭道りを歩いて８分ほど 国立駅から589m,,,カード可 （JCB、AMEX） 電子マネー可,"35.695388638606474,139.45068988474875",042-572-7948,東京都国立市東2-5-15 ,12
,深川 吉野屋,木場駅 342m , 屋形船・クルージング、天ぷら、海鮮,,"￥10,000～￥14,999","￥10,000～￥14,999",3.12,,https://tabelog.com/tokyo/A1313/A131303/13027423/,完全予約制,,東京メトロ東西線木場駅2番出口より左へ。最初の路地を左に入り赤い橋(新田橋)のたもと 木場駅から342m,11:00 - 21:30,■ 営業時間屋形船は、11：00〜19：00の出船で受付要予約■ 定休日年末年始,カード可 （VISA、Master、JCB、AMEX、Diners） 電子マネー可 （交通系電子マネー（Suicaなど）、楽天Edy、WAON、iD） QRコード決済可 （PayPay）,"35.66653783873864,139.80816638420677",03-3644-3562,東京都江東区木場6-12-7 ,11
,天麩羅　まつ井,永田町駅 479m , 天ぷら,,"￥10,000～￥14,999","￥10,000～￥14,999",3.12,-,https://tabelog.com/tokyo/A1308/A130803/13107630/,予約可,,銀座線赤坂駅から徒歩５分 永田町駅から479m,,,カード可 （VISA、Master、JCB、AMEX、Diners）,"35.68107772945795,139.73492720733486",03-3265-7591,東京都千代田区紀尾井町4-1 ホテルニューオータニ東京 タワー館6Fなだ万内,7
,宮武讃岐うどん ららぽーと立川立飛店,立飛駅 137m , うどん、天ぷら、おにぎり,,～￥999,～￥999,3.11,-,https://tabelog.com/tokyo/A1329/A132901/13189977/,予約不可,,立飛駅から137m,10:30 - 20:00L.O. 19:30,■ 営業時間★2021年6月14日現在、平日は11:00〜■ 定休日不定休(ららぽーと立川立飛に準ずる),カード可 電子マネー可,"35.71317483858464,139.41763788495157",042-540-6219,東京都立川市泉町935-1 ららぽーと立川立飛 3F,62
,丸亀製麺 環八平和台店,平和台駅 447m , うどん、天ぷら、丼,,～￥999,～￥999,3.11,-,https://tabelog.com/tokyo/A1322/A132202/13216614/,予約可,,平和台駅から447m,,,カード可 （JCB、AMEX） 電子マネー可 （交通系電子マネー（Suicaなど）） QRコード決済可,"35.75641953863098,139.64935228522594",03-3559-9333,東京都練馬区北町6-34-6 コンフォール平和台 1F,48
,なおじん,岩本町駅 259m , 居酒屋、海鮮、天ぷら,秋葉原駅3分◆26年続く老舗の和食居酒屋で、ほっとするひとときをお過ごしください。半個室有,"￥3,000～￥3,999","￥3,000～￥3,999",3.11,,https://tabelog.com/tokyo/A1310/A131002/13031350/,予約可,,JR「秋葉原駅」　昭和通り口　徒歩3分地下鉄日比谷線「秋葉原駅」　4番出口　徒歩2分地下鉄都営新宿線「岩本町駅」A4出口　徒歩3分 岩本町駅から259m,17:00 - 00:00L.O. 料理22:30 ドリンク23:30,■ 定休日※休日ご利用の際はお気軽にご相談ください。 ◆年末年始のお休み◆12/30～1/3◆,カード可 （VISA、Master、JCB、AMEX、Diners） 電子マネー不可 QRコード決済可 （PayPay、d払い、au PAY）,"35.69750203870892,139.77660998454164",03-3861-4630,東京都千代田区神田佐久間町2-8 小松ビル 1F,26
,味乃宮川 立川ガーデンテーブルズ店,立川北駅 171m , うなぎ、天ぷら、日本料理,,"￥4,000～￥4,999","￥4,000～￥4,999",3.11,-,https://tabelog.com/tokyo/A1329/A132901/13220461/,予約可,,立川北駅から171m,11:00 - 22:00,■ 定休日不定休(立川ガーデンテーブルズに準ずる),カード可 （VISA、Master、JCB、AMEX、Diners） 電子マネー可,"35.70104813859088,139.41300398483236",042-512-5524,東京都立川市曙町2-39-3 立川髙島屋 9F,18
,農家の居酒屋 831,小川駅 242m , 居酒屋、天ぷら,,"￥3,000～￥3,999","￥3,000～￥3,999",3.11,,https://tabelog.com/tokyo/A1328/A132804/13248766/,予約可,ご予約をありがとうございます。,西武拝島線・国分寺線小川駅西口　徒歩3分 小川駅から242m,11:30 - 14:00L.O. 13:30,ネット予約は3日前まで、それ以降はお電話にてご予約願います。,カード可 （VISA、Master、JCB、AMEX、Diners） 電子マネー可 （交通系電子マネー（Suicaなど）、iD、QUICPay） QRコード決済可 （PayPay、d払い、au PAY）,"35.735544038584635,139.46222228514628",042-403-5644,東京都小平市小川西町4-9-5 ,13
,天ん洋,経堂駅 251m , 居酒屋、海鮮、天ぷら,,"￥3,000～￥3,999","￥3,000～￥3,999",3.11,日曜日,https://tabelog.com/tokyo/A1318/A131813/13013820/,予約可,,小田急線経堂駅 徒歩3分 西通り沿い左側の白い看板が目印です。 経堂駅から251m,17:00 - 01:00L.O. 00:30,※団体様ご予約は定休日や営業時間外もご相談可※日曜日（定休日）営業により月曜日等に臨時休業の場合もあり※団体様貸切等により通常営業時間より早く閉めてしまう場合や通常営業なしの日もあり。,カード不可 電子マネー不可 QRコード決済可 （PayPay）,"35.650723038693194,139.63389748416918",03-3426-1129,東京都世田谷区経堂3-2-11 ,12
,旬菜 甚兵衛,新三河島駅 193m , 居酒屋、天ぷら,,"￥5,000～￥5,999","￥5,000～￥5,999",3.11,,https://tabelog.com/tokyo/A1324/A132401/13182199/,予約可,お昼のご予約も承ります,JR「西日暮里」駅下車徒歩10分京成電鉄「新三河島」駅下車徒歩5分常磐線「三河島」駅下車徒歩7分 新三河島駅から193m,,,カード不可 電子マネー不可 QRコード決済不可,"35.73566503868415,139.77491628492834",03-3805-2311,東京都荒川区西日暮里1-30-10 ,11
,天室,新馬場駅 353m , 天ぷら,,"￥8,000～￥9,999","￥8,000～￥9,999",3.11,月曜日、火曜日、水曜日、日曜日,https://tabelog.com/tokyo/A1314/A131405/13216758/,予約可,,京急本線　新馬場駅　徒歩３分京急本線　青物横丁駅　徒歩７分 新馬場駅から353m,,,カード可 （VISA、Master、JCB、AMEX、Diners） 電子マネー不可,"35.614441638751344,139.7441791837254",03-6712-1805,東京都品川区南品川2-13-10 ,9
,天丼てんや 羽田空港第2ターミナル店,羽田空港第２ターミナル（東京モノレール）駅 48m , 天丼、天ぷら,,～￥999,～￥999,3.1,-,https://tabelog.com/tokyo/A1315/A131504/13175728/,予約不可,,京急線、東京モノレール　羽田空港第2ターミナル駅下車　すぐ 羽田空港第２ターミナル駅（東京モノレール）から48m,,,カード不可 電子マネー可 （交通系電子マネー（Suicaなど）） QRコード決済可,"35.551265238805385,139.78785168305663",03-3747-0595,東京都大田区羽田空港3-4-2 羽田空港第2ターミナル B1F,166
,うまい鮨勘 大井町支店,大井町駅 167m , 寿司、天ぷら、海鮮,豊洲市場直送！目利きのプロが吟味した新鮮美味な鮮魚をリーズナブルに味わえる,"￥4,000～￥4,999","￥4,000～￥4,999",3.1,,https://tabelog.com/tokyo/A1315/A131501/13038410/,予約可,土日祝日、大型連休等混み合う事が予想される場合、お席の時間は2時間までとなりますご了承ください,大井町駅、東口から市役所通りを抜け、すずらん通り沿い。セブンイレブンの左隣です。 大井町駅から167m,11:30 - 14:30,■ 営業時間テイクアウト・デリバリーアプリ等の最終受付は店内L.O.時間同様■ 定休【2024年定休】11月…5日（火）,カード可 （VISA、Master、JCB、AMEX、Diners） 電子マネー可 （交通系電子マネー（Suicaなど）、楽天Edy、nanaco、WAON、QUICPay） QRコード決済可 （PayPay、d払い、au PAY）,"35.608006638752926,139.73629688366591",03-5715-1445,東京都品川区東大井5-1-12 ,152
,天丼てんや 八重洲店,東京駅 233m , 天丼、天ぷら,,～￥999,～￥999,3.1,-,https://tabelog.com/tokyo/A1302/A130201/13047320/,予約不可,【モバイルオーダー利用可能店舗】ネットでテイクアウト（お持ち帰り）したいメニューを注文・決済し、店頭で受け取り可能。,ＪＲ「東京駅」八重洲地下中央口 直結、八重洲地下街（B１F） に立地＝ヤエチカ（八重洲地下街）へのアクセス＝【鉄道利用】＜ＪＲ利用＞・ＪＲ各線「東京駅」八重洲中央口、八重洲南口、八重洲北口 から 徒歩１分※丸の内側から徒歩にてお越しの場合は、「北自由通路」または「北地下自由通路」をご利用ください。＜東京メトロ利用＞・銀座線・東西線、都営浅草線「日本橋駅」 A3・B1・B3出口 から 徒歩約６分・銀座線「京橋駅」8出口 から 徒歩約７分・東西線「大手町駅」B7・B10出口 から 徒歩約15分・丸ノ内線「東京駅」 から 徒歩約10分【自動車利用】ヤエチカ（八重洲地下街）直結、東京駅八重洲パーキング（B2F）をご利用ください。 東京駅から233m,10:00 - 22:00L.O. 21:30,■定休日八重洲地下街に準ずる,カード可 （VISA、Master、JCB、AMEX、Diners） 電子マネー可 （交通系電子マネー（Suicaなど）、楽天Edy、WAON、iD、QUICPay） QRコード決済可 （PayPay、d払い、楽天ペイ、au PAY）,"35.6790274157764,139.76802483075832",03-3275-2706,東京都中央区八重洲2-1 八重洲地下街 南１号　外堀地下1番通り,136
,銀座 天一 池袋西武店,池袋駅 110m , 天ぷら、天丼,,"￥3,000～￥3,999","￥3,000～￥3,999",3.1,-,https://tabelog.com/tokyo/A1305/A130501/13010826/,予約可,,JR・西武池袋線・東武東上線・丸の内線・有楽町線各線池袋駅池袋西武デパート食堂街 池袋駅から110m,,,カード可 （AMEX） 電子マネー可 QRコード決済不可,"35.73025383866757,139.71208188491767",03-3984-1930,東京都豊島区南池袋1-28-1 西武池袋本店 8F,118
,天ぷら新宿つな八 北千住店,北千住駅 154m , 天ぷら、海鮮、居酒屋,【北千住マルイ9F】四季折々の食材を豊富に取り揃え、皆様のご来店をお待ちしております。,"￥4,000～￥4,999","￥4,000～￥4,999",3.1,,https://tabelog.com/tokyo/A1324/A132402/13027996/,予約可,,ＪＲ常磐線北千住駅　西口　徒歩1分 北千住駅から154m,11:00 - 21:00L.O. 20:00,■ 営業時間[ランチ]11：00〜16:00 （L.O.16:00）■ 定休日不定休　（千住ミルディスに準ずる）,カード可 （VISA、Master、JCB、AMEX、Diners） 電子マネー不可 QRコード決済不可,"35.750621238684104,139.8046027850586",03-4376-5906,東京都足立区千住3-92 千住ミルディス ９Ｆ,68
,丸亀製麺 中野坂上店,中野坂上駅 61m , うどん、天ぷら,,～￥999,～￥999,3.1,-,https://tabelog.com/tokyo/A1319/A131903/13142428/,予約不可,,都営大江戸線、東京メトロ丸の内線中野坂上駅隣接、徒歩１分 中野坂上駅から61m,11:00 - 22:00L.O. 21:30,■ 定休日不定休,カード可 （VISA、Master） 電子マネー可 （交通系電子マネー（Suicaなど）、楽天Edy、nanaco、iD）,"35.69672483867932,139.68210128460004",03-3377-0230,東京都中野区本町2-46-1 中野坂上サンブライトツインビル B1F,64
,すし屋 銀蔵 大手町ファーストスクエア店,大手町駅 100m , 寿司、居酒屋、天ぷら,親睦会や慶事法事、各種ご宴会のご予約承ります。,"￥3,000～￥3,999","￥3,000～￥3,999",3.1,土曜日、日曜日、祝日,https://tabelog.com/tokyo/A1302/A130201/13152081/,予約可,,地下鉄千代田線大手町駅 C8番出口 徒歩1分 地下鉄半蔵門線大手町駅 C8番出口 徒歩1分 都営三田線大手町駅 C11番出口 徒歩3分 ＪＲ東京駅 丸の内北口 徒歩5分 大手町駅から100m,11:30 - 14:30L.O. 14:00,■ 営業時間営業時間は予告なく変更になる場合がございます。,カード可 （VISA、Master、JCB、Diners） 電子マネー可 （交通系電子マネー（Suicaなど）、QUICPay） QRコード決済可 （PayPay）,"35.68570313871233,139.7637433844315",03-5222-3556,東京都千代田区大手町1-5-1 大手町ファーストスクエア ウエストタワー B1F,64
,銀座 天一 池袋東武店,池袋駅 65m , 天ぷら、天丼,,"￥1,000～￥1,999","￥1,000～￥1,999",3.1,-,https://tabelog.com/tokyo/A1305/A130501/13025287/,予約不可,,JR・東武・西武・東京メトロ　池袋駅隣接 池袋駅から65m,10:00 - 20:00L.O. 19:00,■ 定休日東武百貨店池袋店に準ずる,カード可 電子マネー可 QRコード決済可,"35.730398938667,139.71057548492024",03-5391-3210,東京都豊島区西池袋1-1-25 東武百貨店池袋店 B2F,55
,粋,旗の台駅 79m , 海鮮、天ぷら、居酒屋,,"￥4,000～￥4,999","￥4,000～￥4,999",3.1,日曜日,https://tabelog.com/tokyo/A1317/A131712/13120562/,予約可,,東急池上線・東急大井町線　旗の台駅から徒歩　３０秒 旗の台駅から79m,17:00 - 00:00L.O. 23:00,■ 定休日不定休（Instagramに掲載）,カード可 （VISA、Master） 電子マネー不可 QRコード決済可 （PayPay）,"35.604783138744594,139.7036960836562",03-3788-1230,東京都品川区旗の台3-13-5 こづちやビル２Ｆ,29
,米ぷら,汐留駅 316m , 天ぷら,,"￥1,000～￥1,999","￥1,000～￥1,999",3.1,日曜日、祝日,https://tabelog.com/tokyo/A1301/A130103/13294615/,予約不可,,汐留駅から281m 汐留駅から316m,11:30 - 15:00L.O. 14:30,年末年始等、施設の休館スケジュールによる,カード可 電子マネー可 QRコード決済不可,"35.66495793872511,139.76251358422277",03-6824-7206,東京都港区東新橋1-8-2 カレッタ汐留 B2F,26
,竹乃家 支店,高尾山口駅 313m , 天ぷら、そば,,-,-,3.1,-,https://tabelog.com/tokyo/A1329/A132905/13042684/,予約可,,高尾山口駅から313m,,,,"35.62966648890279,139.2695768328157",不明の為情報お待ちしております,東京都八王子市高尾町2405 ,24
,立呑み 魚椿 蒲田東口店,蒲田駅 196m , 天ぷら、海鮮、日本料理,,"￥2,000～￥2,999","￥2,000～￥2,999",3.1,-,https://tabelog.com/tokyo/A1315/A131503/13287498/,予約不可,,ＪＲ京浜東北線 蒲田駅 東口　徒歩3分蒲田駅から180m 蒲田駅から196m,,,カード可 （VISA、Master、JCB、AMEX、Diners） 電子マネー可 （交通系電子マネー（Suicaなど）、QUICPay） QRコード決済不可,"35.56232993877616,139.71819468321726",03-6428-6627,東京都大田区蒲田5-19-3 ,19
,天ぷら甲子,五反野駅 548m , 天ぷら,,-,-,3.1,月曜日,https://tabelog.com/tokyo/A1324/A132404/13038098/,予約可,,東武スカイツリーライン　五反野駅より徒歩約8分都バス　千住車庫前　下車　徒歩約３分東武バス　高砂町　下車　すぐ 五反野駅から548m,,,カード可 （JCB、AMEX） 電子マネー可,"35.76391873867554,139.80424458519315",03-3889-0611,東京都足立区足立1-11-15 ,15
,大坪,銀座一丁目駅 94m , 天ぷら,,"￥10,000～￥14,999","￥10,000～￥14,999",3.1,-,https://tabelog.com/tokyo/A1301/A130101/13017177/,,,銀座一丁目駅から94m,,,カード可 （JCB、AMEX、Diners）,"35.675089879802236,139.76730186100278",03-5250-0137,東京都中央区銀座1-5-1 第三太陽ビル　２Ｆ,15
,根魚 静,梅島駅 85m , 居酒屋、海鮮、天ぷら,,"￥6,000～￥7,999","￥6,000～￥7,999",3.1,日曜日、祝日,https://tabelog.com/tokyo/A1324/A132404/13016871/,予約可,,梅島駅から85m,,,カード可 （JCB、AMEX、Diners）,"35.77310033866783,139.79830798529005",03-3849-0361,東京都足立区梅島1-14-1 小宮ビル　１Ｆ,13
,天三,入谷駅 161m , 天ぷら,,-,-,3.1,-,https://tabelog.com/tokyo/A1311/A131104/13024928/,予約可,,東京メトロ日比谷線　入谷駅　１出入り口　徒歩３分日比谷線入谷駅交差点方面下車。言問通りを浅草方面に歩いて５〜６分。仲入谷交差点を左に曲がってすぐ。 入谷駅から161m,,,カード可 （JCB、AMEX、Diners）,"35.719739638697746,139.78586088475978",03-3872-8236,東京都台東区入谷1-8-1 ,13
,小田原,品川駅 303m , 天ぷら,,"￥8,000～￥9,999","￥8,000～￥9,999",3.1,-,https://tabelog.com/tokyo/A1314/A131403/13056811/,,,JR線・京浜急行品川駅高輪口より徒歩2分 品川駅から303m,,,カード可 （VISA、Master、JCB、AMEX、Diners）,"35.627927034114876,139.73541461401075",03-5421-1114,東京都港区高輪4-10-30 品川プリンスホテル　味街道 五十三次 新館　38Ｆ,12
,みつ乃家,三鷹駅 872m , 天ぷら、そば、うどん,,～￥999,～￥999,3.1,水曜日、木曜日,https://tabelog.com/tokyo/A1320/A132002/13243088/,予約可,,三鷹駅北口より徒歩15分。 三鷹駅から872m,11:00 - 14:30L.O. 14:00,■ 営業時間予定数量が終了した際は営業時間内でも閉店。,カード可 （JCB、AMEX） 電子マネー可,"35.70956553863105,139.55611278481805",0422-38-4961,東京都武蔵野市西久保2-25-3 ,9
,いろり庵きらく アトレヴィ三鷹店,三鷹駅 9m , そば、うどん、天ぷら,,～￥999,～￥999,3.09,-,https://tabelog.com/tokyo/A1320/A132002/13094355/,予約不可,,JR中央線三鷹駅　改札脇 三鷹駅から9m,,,カード不可 電子マネー可 QRコード決済不可,"35.70271737395061,139.56083539153545",0422-27-7231,東京都三鷹市下連雀3-46-1 JR三鷹駅 アトレヴィ三鷹内,180
